{
  "aspect_ratio": "9:16",
  "duration_ms": 5000,
  "external_provider_state": "NOT_RUN",
  "frames": [
    {
      "a_roll_state": "absent",
      "acceptance_checks": [
        "Primary subject and editable label remain inside the planning safe zone.",
        "Frame differs materially from the previous state in meaning or visual orientation.",
        "No generated pixel text is relied on for final production."
      ],
      "broll_function": "prove_state",
      "caption_relation": "keyword_emphasis",
      "composition": "layered_pip clean-room 9:16 composition with editable overlays and safe-zone guide.",
      "end_ms": 1000,
      "frame_id": "SF-026-F01",
      "image_path": "frames/SF-026-F01.svg",
      "motion": "measured_beat motion; use match_on_action only at this state boundary.",
      "on_screen_text": "BEFORE",
      "sequence_number": 1,
      "shot_scale": "close",
      "sound_cue": "ambient_bed aligned to the before boundary; licensed or original audio only.",
      "start_ms": 0,
      "story_function": "before",
      "transition": "match_on_action",
      "visual_change": "Manual to Governed: before; advance one meaningful information state."
    },
    {
      "a_roll_state": "absent",
      "acceptance_checks": [
        "Primary subject and editable label remain inside the planning safe zone.",
        "Frame differs materially from the previous state in meaning or visual orientation.",
        "No generated pixel text is relied on for final production."
      ],
      "broll_function": "prove_state",
      "caption_relation": "on_cut",
      "composition": "layered_pip clean-room 9:16 composition with editable overlays and safe-zone guide.",
      "end_ms": 2000,
      "frame_id": "SF-026-F02",
      "image_path": "frames/SF-026-F02.svg",
      "motion": "measured_beat motion; use match_on_action only at this state boundary.",
      "on_screen_text": "FRICTION",
      "sequence_number": 2,
      "shot_scale": "medium",
      "sound_cue": "ambient_bed aligned to the friction boundary; licensed or original audio only.",
      "start_ms": 1000,
      "story_function": "friction",
      "transition": "match_on_action",
      "visual_change": "Manual to Governed: friction; advance one meaningful information state."
    },
    {
      "a_roll_state": "full",
      "acceptance_checks": [
        "Primary subject and editable label remain inside the planning safe zone.",
        "Frame differs materially from the previous state in meaning or visual orientation.",
        "No generated pixel text is relied on for final production."
      ],
      "broll_function": "prove_state",
      "caption_relation": "on_cut",
      "composition": "layered_pip clean-room 9:16 composition with editable overlays and safe-zone guide.",
      "end_ms": 3000,
      "frame_id": "SF-026-F03",
      "image_path": "frames/SF-026-F03.svg",
      "motion": "measured_beat motion; use match_on_action only at this state boundary.",
      "on_screen_text": "CHANGE",
      "sequence_number": 3,
      "shot_scale": "medium",
      "sound_cue": "ambient_bed aligned to the change action boundary; licensed or original audio only.",
      "start_ms": 2000,
      "story_function": "change action",
      "transition": "match_on_action",
      "visual_change": "Manual to Governed: change action; advance one meaningful information state."
    },
    {
      "a_roll_state": "voice_over",
      "acceptance_checks": [
        "Primary subject and editable label remain inside the planning safe zone.",
        "Frame differs materially from the previous state in meaning or visual orientation.",
        "No generated pixel text is relied on for final production."
      ],
      "broll_function": "prove_state",
      "caption_relation": "keyword_emphasis",
      "composition": "layered_pip clean-room 9:16 composition with editable overlays and safe-zone guide.",
      "end_ms": 4000,
      "frame_id": "SF-026-F04",
      "image_path": "frames/SF-026-F04.svg",
      "motion": "measured_beat motion; use match_on_action only at this state boundary.",
      "on_screen_text": "LIMIT",
      "sequence_number": 4,
      "shot_scale": "medium",
      "sound_cue": "ambient_bed aligned to the limitation boundary; licensed or original audio only.",
      "start_ms": 3000,
      "story_function": "limitation",
      "transition": "match_on_action",
      "visual_change": "Manual to Governed: limitation; advance one meaningful information state."
    },
    {
      "a_roll_state": "return_cut",
      "acceptance_checks": [
        "Primary subject and editable label remain inside the planning safe zone.",
        "Frame differs materially from the previous state in meaning or visual orientation.",
        "No generated pixel text is relied on for final production."
      ],
      "broll_function": "prove_state",
      "caption_relation": "on_cut",
      "composition": "layered_pip clean-room 9:16 composition with editable overlays and safe-zone guide.",
      "end_ms": 5000,
      "frame_id": "SF-026-F05",
      "image_path": "frames/SF-026-F05.svg",
      "motion": "measured_beat motion; use match_on_action only at this state boundary.",
      "on_screen_text": "COMPARE",
      "sequence_number": 5,
      "shot_scale": "medium",
      "sound_cue": "ambient_bed aligned to the hold comparison boundary; licensed or original audio only.",
      "start_ms": 4000,
      "story_function": "hold comparison",
      "transition": "match_on_action",
      "visual_change": "Manual to Governed: hold comparison; advance one meaningful information state."
    }
  ],
  "framework_id": "SF-026",
  "kind": "intro_broll",
  "name": "Manual to Governed",
  "purpose": "Show added governance without hype",
  "rights_state": "original_local_previsualization",
  "signal_input": {
    "evidence_ids": [
      "EVID-WEB-006"
    ],
    "export_id": "SIGEXP-SF-026",
    "export_schema": "signal-to-studio.v1",
    "record_hash": "sha256:b4d3223adb3fd1ccdd0bc1a8086ec63a3fbe0e6167b2b27554d4d3c18e23c3f8",
    "rights_decision_ids": [
      "RIGHTS-PUBLIC-COMMENTARY-001"
    ],
    "source_ids": [
      "SRC-WEB-004"
    ],
    "source_rights_state": "metadata_commentary_only"
  },
  "taxonomy": {
    "a_roll_integration": "delayed_reveal",
    "broll_function": "prove_state",
    "cta_exit": "loop_to_open",
    "hook_mechanism": "before_after",
    "pacing_profile": "measured_beat",
    "proof_form": "calculation",
    "risk_class": "low",
    "sound_role": "ambient_bed",
    "text_role": "headline_only",
    "transition_family": "match_on_action",
    "viewer_job": "imagine_outcome",
    "visual_grammar": "layered_pip"
  },
  "version": "1.0.0"
}
