{
  "aspect_ratio": "9:16",
  "duration_ms": 4000,
  "external_provider_state": "NOT_RUN",
  "frames": [
    {
      "a_roll_state": "picture_in_picture",
      "acceptance_checks": [
        "Primary subject and editable label remain inside the planning safe zone.",
        "Frame differs materially from the previous state in meaning or visual orientation.",
        "No generated pixel text is relied on for final production."
      ],
      "broll_function": "contrast",
      "caption_relation": "keyword_emphasis",
      "composition": "object_macro clean-room 9:16 composition with editable overlays and safe-zone guide.",
      "end_ms": 1000,
      "frame_id": "SF-031-F01",
      "image_path": "frames/SF-031-F01.svg",
      "motion": "measured_beat motion; use graphic_reveal only at this state boundary.",
      "on_screen_text": "3 THINGS",
      "sequence_number": 1,
      "shot_scale": "macro",
      "sound_cue": "music_pulse aligned to the number promise boundary; licensed or original audio only.",
      "start_ms": 0,
      "story_function": "number promise",
      "transition": "graphic_reveal",
      "visual_change": "Three Warning Signs: number promise; advance one meaningful information state."
    },
    {
      "a_roll_state": "picture_in_picture",
      "acceptance_checks": [
        "Primary subject and editable label remain inside the planning safe zone.",
        "Frame differs materially from the previous state in meaning or visual orientation.",
        "No generated pixel text is relied on for final production."
      ],
      "broll_function": "contrast",
      "caption_relation": "on_cut",
      "composition": "object_macro clean-room 9:16 composition with editable overlays and safe-zone guide.",
      "end_ms": 2000,
      "frame_id": "SF-031-F02",
      "image_path": "frames/SF-031-F02.svg",
      "motion": "measured_beat motion; use graphic_reveal only at this state boundary.",
      "on_screen_text": "01",
      "sequence_number": 2,
      "shot_scale": "macro",
      "sound_cue": "music_pulse aligned to the item one boundary; licensed or original audio only.",
      "start_ms": 1000,
      "story_function": "item one",
      "transition": "graphic_reveal",
      "visual_change": "Three Warning Signs: item one; advance one meaningful information state."
    },
    {
      "a_roll_state": "picture_in_picture",
      "acceptance_checks": [
        "Primary subject and editable label remain inside the planning safe zone.",
        "Frame differs materially from the previous state in meaning or visual orientation.",
        "No generated pixel text is relied on for final production."
      ],
      "broll_function": "contrast",
      "caption_relation": "on_cut",
      "composition": "object_macro clean-room 9:16 composition with editable overlays and safe-zone guide.",
      "end_ms": 3000,
      "frame_id": "SF-031-F03",
      "image_path": "frames/SF-031-F03.svg",
      "motion": "measured_beat motion; use graphic_reveal only at this state boundary.",
      "on_screen_text": "03",
      "sequence_number": 3,
      "shot_scale": "medium",
      "sound_cue": "music_pulse aligned to the item three boundary; licensed or original audio only.",
      "start_ms": 2000,
      "story_function": "item three",
      "transition": "graphic_reveal",
      "visual_change": "Three Warning Signs: item three; advance one meaningful information state."
    },
    {
      "a_roll_state": "picture_in_picture",
      "acceptance_checks": [
        "Primary subject and editable label remain inside the planning safe zone.",
        "Frame differs materially from the previous state in meaning or visual orientation.",
        "No generated pixel text is relied on for final production."
      ],
      "broll_function": "contrast",
      "caption_relation": "keyword_emphasis",
      "composition": "object_macro clean-room 9:16 composition with editable overlays and safe-zone guide.",
      "end_ms": 4000,
      "frame_id": "SF-031-F04",
      "image_path": "frames/SF-031-F04.svg",
      "motion": "measured_beat motion; use graphic_reveal only at this state boundary.",
      "on_screen_text": "SAVE",
      "sequence_number": 4,
      "shot_scale": "macro",
      "sound_cue": "music_pulse aligned to the save exit boundary; licensed or original audio only.",
      "start_ms": 3000,
      "story_function": "save exit",
      "transition": "graphic_reveal",
      "visual_change": "Three Warning Signs: save exit; advance one meaningful information state."
    }
  ],
  "framework_id": "SF-031",
  "kind": "hook_intro",
  "name": "Three Warning Signs",
  "purpose": "Package a diagnostic list",
  "rights_state": "original_local_previsualization",
  "signal_input": {
    "evidence_ids": [
      "EVID-WEB-007"
    ],
    "export_id": "SIGEXP-SF-031",
    "export_schema": "signal-to-studio.v1",
    "record_hash": "sha256:2ebbc6db536bb9edb1bfb5f023c0edcd2022c2717fd1b71b60fd7a54ff12ecef",
    "rights_decision_ids": [
      "RIGHTS-PUBLIC-COMMENTARY-001"
    ],
    "source_ids": [
      "SRC-WEB-005"
    ],
    "source_rights_state": "metadata_commentary_only"
  },
  "taxonomy": {
    "a_roll_integration": "picture_in_picture",
    "broll_function": "contrast",
    "cta_exit": "save_reference",
    "hook_mechanism": "countdown",
    "pacing_profile": "measured_beat",
    "proof_form": "process_trace",
    "risk_class": "source_dependent",
    "sound_role": "music_pulse",
    "text_role": "labels",
    "transition_family": "graphic_reveal",
    "viewer_job": "imagine_outcome",
    "visual_grammar": "object_macro"
  },
  "version": "1.0.0"
}
