{
  "aspect_ratio": "9:16",
  "duration_ms": 8000,
  "external_provider_state": "NOT_RUN",
  "frames": [
    {
      "a_roll_state": "voice_over",
      "acceptance_checks": [
        "Primary subject and editable label remain inside the planning safe zone.",
        "Frame differs materially from the previous state in meaning or visual orientation.",
        "No generated pixel text is relied on for final production."
      ],
      "broll_function": "demonstrate_process",
      "caption_relation": "keyword_emphasis",
      "composition": "kinetic_type clean-room 9:16 composition with editable overlays and safe-zone guide.",
      "end_ms": 1000,
      "frame_id": "SF-053-F01",
      "image_path": "frames/SF-053-F01.svg",
      "motion": "rapid_beat motion; use wipe only at this state boundary.",
      "on_screen_text": "IN PROGRESS",
      "sequence_number": 1,
      "shot_scale": "close",
      "sound_cue": "voice_anchor aligned to the scene in progress boundary; licensed or original audio only.",
      "start_ms": 0,
      "story_function": "scene in progress",
      "transition": "wipe",
      "visual_change": "One-Minute Audit: scene in progress; advance one meaningful information state."
    },
    {
      "a_roll_state": "voice_over",
      "acceptance_checks": [
        "Primary subject and editable label remain inside the planning safe zone.",
        "Frame differs materially from the previous state in meaning or visual orientation.",
        "No generated pixel text is relied on for final production."
      ],
      "broll_function": "demonstrate_process",
      "caption_relation": "on_cut",
      "composition": "kinetic_type clean-room 9:16 composition with editable overlays and safe-zone guide.",
      "end_ms": 2000,
      "frame_id": "SF-053-F02",
      "image_path": "frames/SF-053-F02.svg",
      "motion": "rapid_beat motion; use wipe only at this state boundary.",
      "on_screen_text": "STAKES",
      "sequence_number": 2,
      "shot_scale": "medium",
      "sound_cue": "voice_anchor aligned to the stakes boundary; licensed or original audio only.",
      "start_ms": 1000,
      "story_function": "stakes",
      "transition": "wipe",
      "visual_change": "One-Minute Audit: stakes; advance one meaningful information state."
    },
    {
      "a_roll_state": "voice_over",
      "acceptance_checks": [
        "Primary subject and editable label remain inside the planning safe zone.",
        "Frame differs materially from the previous state in meaning or visual orientation.",
        "No generated pixel text is relied on for final production."
      ],
      "broll_function": "demonstrate_process",
      "caption_relation": "on_cut",
      "composition": "kinetic_type clean-room 9:16 composition with editable overlays and safe-zone guide.",
      "end_ms": 3000,
      "frame_id": "SF-053-F03",
      "image_path": "frames/SF-053-F03.svg",
      "motion": "rapid_beat motion; use wipe only at this state boundary.",
      "on_screen_text": "DECIDE",
      "sequence_number": 3,
      "shot_scale": "medium",
      "sound_cue": "voice_anchor aligned to the decision boundary; licensed or original audio only.",
      "start_ms": 2000,
      "story_function": "decision",
      "transition": "wipe",
      "visual_change": "One-Minute Audit: decision; advance one meaningful information state."
    },
    {
      "a_roll_state": "voice_over",
      "acceptance_checks": [
        "Primary subject and editable label remain inside the planning safe zone.",
        "Frame differs materially from the previous state in meaning or visual orientation.",
        "No generated pixel text is relied on for final production."
      ],
      "broll_function": "demonstrate_process",
      "caption_relation": "keyword_emphasis",
      "composition": "kinetic_type clean-room 9:16 composition with editable overlays and safe-zone guide.",
      "end_ms": 4000,
      "frame_id": "SF-053-F04",
      "image_path": "frames/SF-053-F04.svg",
      "motion": "rapid_beat motion; use wipe only at this state boundary.",
      "on_screen_text": "ACT",
      "sequence_number": 4,
      "shot_scale": "medium",
      "sound_cue": "voice_anchor aligned to the action boundary; licensed or original audio only.",
      "start_ms": 3000,
      "story_function": "action",
      "transition": "wipe",
      "visual_change": "One-Minute Audit: action; advance one meaningful information state."
    },
    {
      "a_roll_state": "voice_over",
      "acceptance_checks": [
        "Primary subject and editable label remain inside the planning safe zone.",
        "Frame differs materially from the previous state in meaning or visual orientation.",
        "No generated pixel text is relied on for final production."
      ],
      "broll_function": "demonstrate_process",
      "caption_relation": "on_cut",
      "composition": "kinetic_type clean-room 9:16 composition with editable overlays and safe-zone guide.",
      "end_ms": 5000,
      "frame_id": "SF-053-F05",
      "image_path": "frames/SF-053-F05.svg",
      "motion": "rapid_beat motion; use wipe only at this state boundary.",
      "on_screen_text": "RESULT",
      "sequence_number": 5,
      "shot_scale": "medium",
      "sound_cue": "voice_anchor aligned to the result boundary; licensed or original audio only.",
      "start_ms": 4000,
      "story_function": "result",
      "transition": "wipe",
      "visual_change": "One-Minute Audit: result; advance one meaningful information state."
    },
    {
      "a_roll_state": "voice_over",
      "acceptance_checks": [
        "Primary subject and editable label remain inside the planning safe zone.",
        "Frame differs materially from the previous state in meaning or visual orientation.",
        "No generated pixel text is relied on for final production."
      ],
      "broll_function": "demonstrate_process",
      "caption_relation": "continuous",
      "composition": "kinetic_type clean-room 9:16 composition with editable overlays and safe-zone guide.",
      "end_ms": 6000,
      "frame_id": "SF-053-F06",
      "image_path": "frames/SF-053-F06.svg",
      "motion": "rapid_beat motion; use wipe only at this state boundary.",
      "on_screen_text": "BRIDGE",
      "sequence_number": 6,
      "shot_scale": "medium",
      "sound_cue": "voice_anchor aligned to the bridge detail boundary; licensed or original audio only.",
      "start_ms": 5000,
      "story_function": "bridge detail",
      "transition": "wipe",
      "visual_change": "One-Minute Audit: bridge detail; advance one meaningful information state."
    },
    {
      "a_roll_state": "voice_over",
      "acceptance_checks": [
        "Primary subject and editable label remain inside the planning safe zone.",
        "Frame differs materially from the previous state in meaning or visual orientation.",
        "No generated pixel text is relied on for final production."
      ],
      "broll_function": "demonstrate_process",
      "caption_relation": "continuous",
      "composition": "kinetic_type clean-room 9:16 composition with editable overlays and safe-zone guide.",
      "end_ms": 7000,
      "frame_id": "SF-053-F07",
      "image_path": "frames/SF-053-F07.svg",
      "motion": "rapid_beat motion; use wipe only at this state boundary.",
      "on_screen_text": "HOLD",
      "sequence_number": 7,
      "shot_scale": "medium",
      "sound_cue": "voice_anchor aligned to the proof hold boundary; licensed or original audio only.",
      "start_ms": 6000,
      "story_function": "proof hold",
      "transition": "wipe",
      "visual_change": "One-Minute Audit: proof hold; advance one meaningful information state."
    },
    {
      "a_roll_state": "return_cut",
      "acceptance_checks": [
        "Primary subject and editable label remain inside the planning safe zone.",
        "Frame differs materially from the previous state in meaning or visual orientation.",
        "No generated pixel text is relied on for final production."
      ],
      "broll_function": "demonstrate_process",
      "caption_relation": "continuous",
      "composition": "kinetic_type clean-room 9:16 composition with editable overlays and safe-zone guide.",
      "end_ms": 8000,
      "frame_id": "SF-053-F08",
      "image_path": "frames/SF-053-F08.svg",
      "motion": "rapid_beat motion; use wipe only at this state boundary.",
      "on_screen_text": "LESSON",
      "sequence_number": 8,
      "shot_scale": "medium",
      "sound_cue": "voice_anchor aligned to the lesson boundary; licensed or original audio only.",
      "start_ms": 7000,
      "story_function": "lesson",
      "transition": "wipe",
      "visual_change": "One-Minute Audit: lesson; advance one meaningful information state."
    }
  ],
  "framework_id": "SF-053",
  "kind": "intro_broll",
  "name": "One-Minute Audit",
  "purpose": "Compress an audit into causal beats",
  "rights_state": "original_local_previsualization",
  "signal_input": {
    "evidence_ids": [
      "EVID-WEB-011"
    ],
    "export_id": "SIGEXP-SF-053",
    "export_schema": "signal-to-studio.v1",
    "record_hash": "sha256:3ede4c91aca78195980e0dbeb5f01575a79f8dc1da991ac529e69111fa4ce8dc",
    "rights_decision_ids": [
      "RIGHTS-PUBLIC-COMMENTARY-001"
    ],
    "source_ids": [
      "SRC-WEB-001"
    ],
    "source_rights_state": "metadata_commentary_only"
  },
  "taxonomy": {
    "a_roll_integration": "return_cut",
    "broll_function": "demonstrate_process",
    "cta_exit": "recap",
    "hook_mechanism": "story_in_progress",
    "pacing_profile": "rapid_beat",
    "proof_form": "constraint",
    "risk_class": "source_dependent",
    "sound_role": "voice_anchor",
    "text_role": "keyword_captions",
    "transition_family": "wipe",
    "viewer_job": "identify_problem",
    "visual_grammar": "kinetic_type"
  },
  "version": "1.0.0"
}
