{
  "aspect_ratio": "9:16",
  "duration_ms": 7000,
  "external_provider_state": "NOT_RUN",
  "frames": [
    {
      "a_roll_state": "full",
      "acceptance_checks": [
        "Primary subject and editable label remain inside the planning safe zone.",
        "Frame differs materially from the previous state in meaning or visual orientation.",
        "No generated pixel text is relied on for final production."
      ],
      "broll_function": "prove_state",
      "caption_relation": "keyword_emphasis",
      "composition": "mock_screen_capture clean-room 9:16 composition with editable overlays and safe-zone guide.",
      "end_ms": 1000,
      "frame_id": "SF-022-F01",
      "image_path": "frames/SF-022-F01.svg",
      "motion": "held_reveal motion; use match_on_action only at this state boundary.",
      "on_screen_text": "THIS FAILED",
      "sequence_number": 1,
      "shot_scale": "screen",
      "sound_cue": "accent_sfx aligned to the failure result boundary; licensed or original audio only.",
      "start_ms": 0,
      "story_function": "failure result",
      "transition": "match_on_action",
      "visual_change": "Missing Is Not Zero: failure result; advance one meaningful information state."
    },
    {
      "a_roll_state": "voice_over",
      "acceptance_checks": [
        "Primary subject and editable label remain inside the planning safe zone.",
        "Frame differs materially from the previous state in meaning or visual orientation.",
        "No generated pixel text is relied on for final production."
      ],
      "broll_function": "prove_state",
      "caption_relation": "on_cut",
      "composition": "mock_screen_capture clean-room 9:16 composition with editable overlays and safe-zone guide.",
      "end_ms": 2000,
      "frame_id": "SF-022-F02",
      "image_path": "frames/SF-022-F02.svg",
      "motion": "held_reveal motion; use match_on_action only at this state boundary.",
      "on_screen_text": "FIRST CAUSE",
      "sequence_number": 2,
      "shot_scale": "screen",
      "sound_cue": "accent_sfx aligned to the first cause boundary; licensed or original audio only.",
      "start_ms": 1000,
      "story_function": "first cause",
      "transition": "match_on_action",
      "visual_change": "Missing Is Not Zero: first cause; advance one meaningful information state."
    },
    {
      "a_roll_state": "voice_over",
      "acceptance_checks": [
        "Primary subject and editable label remain inside the planning safe zone.",
        "Frame differs materially from the previous state in meaning or visual orientation.",
        "No generated pixel text is relied on for final production."
      ],
      "broll_function": "prove_state",
      "caption_relation": "on_cut",
      "composition": "mock_screen_capture clean-room 9:16 composition with editable overlays and safe-zone guide.",
      "end_ms": 3000,
      "frame_id": "SF-022-F03",
      "image_path": "frames/SF-022-F03.svg",
      "motion": "held_reveal motion; use match_on_action only at this state boundary.",
      "on_screen_text": "THEN",
      "sequence_number": 3,
      "shot_scale": "screen",
      "sound_cue": "accent_sfx aligned to the chain reaction boundary; licensed or original audio only.",
      "start_ms": 2000,
      "story_function": "chain reaction",
      "transition": "match_on_action",
      "visual_change": "Missing Is Not Zero: chain reaction; advance one meaningful information state."
    },
    {
      "a_roll_state": "voice_over",
      "acceptance_checks": [
        "Primary subject and editable label remain inside the planning safe zone.",
        "Frame differs materially from the previous state in meaning or visual orientation.",
        "No generated pixel text is relied on for final production."
      ],
      "broll_function": "prove_state",
      "caption_relation": "keyword_emphasis",
      "composition": "mock_screen_capture clean-room 9:16 composition with editable overlays and safe-zone guide.",
      "end_ms": 4000,
      "frame_id": "SF-022-F04",
      "image_path": "frames/SF-022-F04.svg",
      "motion": "held_reveal motion; use match_on_action only at this state boundary.",
      "on_screen_text": "IMPACT",
      "sequence_number": 4,
      "shot_scale": "screen",
      "sound_cue": "accent_sfx aligned to the human impact boundary; licensed or original audio only.",
      "start_ms": 3000,
      "story_function": "human impact",
      "transition": "match_on_action",
      "visual_change": "Missing Is Not Zero: human impact; advance one meaningful information state."
    },
    {
      "a_roll_state": "voice_over",
      "acceptance_checks": [
        "Primary subject and editable label remain inside the planning safe zone.",
        "Frame differs materially from the previous state in meaning or visual orientation.",
        "No generated pixel text is relied on for final production."
      ],
      "broll_function": "prove_state",
      "caption_relation": "on_cut",
      "composition": "mock_screen_capture clean-room 9:16 composition with editable overlays and safe-zone guide.",
      "end_ms": 5000,
      "frame_id": "SF-022-F05",
      "image_path": "frames/SF-022-F05.svg",
      "motion": "held_reveal motion; use match_on_action only at this state boundary.",
      "on_screen_text": "CONTROL",
      "sequence_number": 5,
      "shot_scale": "screen",
      "sound_cue": "accent_sfx aligned to the control boundary; licensed or original audio only.",
      "start_ms": 4000,
      "story_function": "control",
      "transition": "match_on_action",
      "visual_change": "Missing Is Not Zero: control; advance one meaningful information state."
    },
    {
      "a_roll_state": "voice_over",
      "acceptance_checks": [
        "Primary subject and editable label remain inside the planning safe zone.",
        "Frame differs materially from the previous state in meaning or visual orientation.",
        "No generated pixel text is relied on for final production."
      ],
      "broll_function": "prove_state",
      "caption_relation": "continuous",
      "composition": "mock_screen_capture clean-room 9:16 composition with editable overlays and safe-zone guide.",
      "end_ms": 6000,
      "frame_id": "SF-022-F06",
      "image_path": "frames/SF-022-F06.svg",
      "motion": "held_reveal motion; use match_on_action only at this state boundary.",
      "on_screen_text": "BRIDGE",
      "sequence_number": 6,
      "shot_scale": "screen",
      "sound_cue": "accent_sfx aligned to the bridge detail boundary; licensed or original audio only.",
      "start_ms": 5000,
      "story_function": "bridge detail",
      "transition": "match_on_action",
      "visual_change": "Missing Is Not Zero: bridge detail; advance one meaningful information state."
    },
    {
      "a_roll_state": "return_cut",
      "acceptance_checks": [
        "Primary subject and editable label remain inside the planning safe zone.",
        "Frame differs materially from the previous state in meaning or visual orientation.",
        "No generated pixel text is relied on for final production."
      ],
      "broll_function": "prove_state",
      "caption_relation": "continuous",
      "composition": "mock_screen_capture clean-room 9:16 composition with editable overlays and safe-zone guide.",
      "end_ms": 7000,
      "frame_id": "SF-022-F07",
      "image_path": "frames/SF-022-F07.svg",
      "motion": "held_reveal motion; use match_on_action only at this state boundary.",
      "on_screen_text": "BACK TO YOU",
      "sequence_number": 7,
      "shot_scale": "screen",
      "sound_cue": "accent_sfx aligned to the return to speaker boundary; licensed or original audio only.",
      "start_ms": 6000,
      "story_function": "return to speaker",
      "transition": "match_on_action",
      "visual_change": "Missing Is Not Zero: return to speaker; advance one meaningful information state."
    }
  ],
  "framework_id": "SF-022",
  "kind": "hook_broll",
  "name": "Missing Is Not Zero",
  "purpose": "Prevent null-to-zero confusion",
  "rights_state": "original_local_previsualization",
  "signal_input": {
    "evidence_ids": [
      "EVID-WEB-005"
    ],
    "export_id": "SIGEXP-SF-022",
    "export_schema": "signal-to-studio.v1",
    "record_hash": "sha256:ec43ebcf3684b87aba763d980d1d7018b7455a6164bab9c5032395ffa5502559",
    "rights_decision_ids": [
      "RIGHTS-PUBLIC-COMMENTARY-001"
    ],
    "source_ids": [
      "SRC-WEB-004"
    ],
    "source_rights_state": "metadata_commentary_only"
  },
  "taxonomy": {
    "a_roll_integration": "full_open",
    "broll_function": "prove_state",
    "cta_exit": "answer_question",
    "hook_mechanism": "consequence",
    "pacing_profile": "held_reveal",
    "proof_form": "observed_artifact",
    "risk_class": "low",
    "sound_role": "accent_sfx",
    "text_role": "labels",
    "transition_family": "match_on_action",
    "viewer_job": "identify_problem",
    "visual_grammar": "mock_screen_capture"
  },
  "version": "1.0.0"
}
