{
  "aspect_ratio": "9:16",
  "duration_ms": 4000,
  "external_provider_state": "NOT_RUN",
  "frames": [
    {
      "a_roll_state": "full",
      "acceptance_checks": [
        "Primary subject and editable label remain inside the planning safe zone.",
        "Frame differs materially from the previous state in meaning or visual orientation.",
        "No generated pixel text is relied on for final production."
      ],
      "broll_function": "demonstrate_process",
      "caption_relation": "keyword_emphasis",
      "composition": "diagram_build clean-room 9:16 composition with editable overlays and safe-zone guide.",
      "end_ms": 1000,
      "frame_id": "SF-025-F01",
      "image_path": "frames/SF-025-F01.svg",
      "motion": "rapid_beat motion; use hard_cut only at this state boundary.",
      "on_screen_text": "BEFORE",
      "sequence_number": 1,
      "shot_scale": "diagram",
      "sound_cue": "silence_drop aligned to the before boundary; licensed or original audio only.",
      "start_ms": 0,
      "story_function": "before",
      "transition": "hard_cut",
      "visual_change": "Clutter to Map: before; advance one meaningful information state."
    },
    {
      "a_roll_state": "voice_over",
      "acceptance_checks": [
        "Primary subject and editable label remain inside the planning safe zone.",
        "Frame differs materially from the previous state in meaning or visual orientation.",
        "No generated pixel text is relied on for final production."
      ],
      "broll_function": "demonstrate_process",
      "caption_relation": "on_cut",
      "composition": "diagram_build clean-room 9:16 composition with editable overlays and safe-zone guide.",
      "end_ms": 2000,
      "frame_id": "SF-025-F02",
      "image_path": "frames/SF-025-F02.svg",
      "motion": "rapid_beat motion; use hard_cut only at this state boundary.",
      "on_screen_text": "FRICTION",
      "sequence_number": 2,
      "shot_scale": "diagram",
      "sound_cue": "silence_drop aligned to the friction boundary; licensed or original audio only.",
      "start_ms": 1000,
      "story_function": "friction",
      "transition": "hard_cut",
      "visual_change": "Clutter to Map: friction; advance one meaningful information state."
    },
    {
      "a_roll_state": "voice_over",
      "acceptance_checks": [
        "Primary subject and editable label remain inside the planning safe zone.",
        "Frame differs materially from the previous state in meaning or visual orientation.",
        "No generated pixel text is relied on for final production."
      ],
      "broll_function": "demonstrate_process",
      "caption_relation": "on_cut",
      "composition": "diagram_build clean-room 9:16 composition with editable overlays and safe-zone guide.",
      "end_ms": 3000,
      "frame_id": "SF-025-F03",
      "image_path": "frames/SF-025-F03.svg",
      "motion": "rapid_beat motion; use hard_cut only at this state boundary.",
      "on_screen_text": "AFTER",
      "sequence_number": 3,
      "shot_scale": "diagram",
      "sound_cue": "silence_drop aligned to the after boundary; licensed or original audio only.",
      "start_ms": 2000,
      "story_function": "after",
      "transition": "hard_cut",
      "visual_change": "Clutter to Map: after; advance one meaningful information state."
    },
    {
      "a_roll_state": "return_cut",
      "acceptance_checks": [
        "Primary subject and editable label remain inside the planning safe zone.",
        "Frame differs materially from the previous state in meaning or visual orientation.",
        "No generated pixel text is relied on for final production."
      ],
      "broll_function": "demonstrate_process",
      "caption_relation": "keyword_emphasis",
      "composition": "diagram_build clean-room 9:16 composition with editable overlays and safe-zone guide.",
      "end_ms": 4000,
      "frame_id": "SF-025-F04",
      "image_path": "frames/SF-025-F04.svg",
      "motion": "rapid_beat motion; use hard_cut only at this state boundary.",
      "on_screen_text": "COMPARE",
      "sequence_number": 4,
      "shot_scale": "diagram",
      "sound_cue": "silence_drop aligned to the hold comparison boundary; licensed or original audio only.",
      "start_ms": 3000,
      "story_function": "hold comparison",
      "transition": "hard_cut",
      "visual_change": "Clutter to Map: hold comparison; advance one meaningful information state."
    }
  ],
  "framework_id": "SF-025",
  "kind": "intro_broll",
  "name": "Clutter to Map",
  "purpose": "Transform scattered context into a navigable map",
  "rights_state": "original_local_previsualization",
  "signal_input": {
    "evidence_ids": [
      "EVID-WEB-006"
    ],
    "export_id": "SIGEXP-SF-025",
    "export_schema": "signal-to-studio.v1",
    "record_hash": "sha256:d6c6c38de1595800813661f86fd54ce14a7c3279fa7d7d33684bdb2264d21276",
    "rights_decision_ids": [
      "RIGHTS-PUBLIC-COMMENTARY-001"
    ],
    "source_ids": [
      "SRC-WEB-004"
    ],
    "source_rights_state": "metadata_commentary_only"
  },
  "taxonomy": {
    "a_roll_integration": "full_open",
    "broll_function": "demonstrate_process",
    "cta_exit": "recap",
    "hook_mechanism": "before_after",
    "pacing_profile": "rapid_beat",
    "proof_form": "observed_artifact",
    "risk_class": "low",
    "sound_role": "silence_drop",
    "text_role": "no_text",
    "transition_family": "hard_cut",
    "viewer_job": "verify_claim",
    "visual_grammar": "diagram_build"
  },
  "version": "1.0.0"
}
