{
  "aspect_ratio": "9:16",
  "duration_ms": 7000,
  "external_provider_state": "NOT_RUN",
  "frames": [
    {
      "a_roll_state": "picture_in_picture",
      "acceptance_checks": [
        "Primary subject and editable label remain inside the planning safe zone.",
        "Frame differs materially from the previous state in meaning or visual orientation.",
        "No generated pixel text is relied on for final production."
      ],
      "broll_function": "attention_reset",
      "caption_relation": "keyword_emphasis",
      "composition": "split_screen clean-room 9:16 composition with editable overlays and safe-zone guide.",
      "end_ms": 1000,
      "frame_id": "SF-028-F01",
      "image_path": "frames/SF-028-F01.svg",
      "motion": "slow_observation motion; use push only at this state boundary.",
      "on_screen_text": "BEFORE",
      "sequence_number": 1,
      "shot_scale": "wide",
      "sound_cue": "voice_plus_accent aligned to the before boundary; licensed or original audio only.",
      "start_ms": 0,
      "story_function": "before",
      "transition": "push",
      "visual_change": "Inbox to Queue: before; advance one meaningful information state."
    },
    {
      "a_roll_state": "picture_in_picture",
      "acceptance_checks": [
        "Primary subject and editable label remain inside the planning safe zone.",
        "Frame differs materially from the previous state in meaning or visual orientation.",
        "No generated pixel text is relied on for final production."
      ],
      "broll_function": "attention_reset",
      "caption_relation": "on_cut",
      "composition": "split_screen clean-room 9:16 composition with editable overlays and safe-zone guide.",
      "end_ms": 2000,
      "frame_id": "SF-028-F02",
      "image_path": "frames/SF-028-F02.svg",
      "motion": "slow_observation motion; use push only at this state boundary.",
      "on_screen_text": "FRICTION",
      "sequence_number": 2,
      "shot_scale": "wide",
      "sound_cue": "voice_plus_accent aligned to the friction boundary; licensed or original audio only.",
      "start_ms": 1000,
      "story_function": "friction",
      "transition": "push",
      "visual_change": "Inbox to Queue: friction; advance one meaningful information state."
    },
    {
      "a_roll_state": "picture_in_picture",
      "acceptance_checks": [
        "Primary subject and editable label remain inside the planning safe zone.",
        "Frame differs materially from the previous state in meaning or visual orientation.",
        "No generated pixel text is relied on for final production."
      ],
      "broll_function": "attention_reset",
      "caption_relation": "on_cut",
      "composition": "split_screen clean-room 9:16 composition with editable overlays and safe-zone guide.",
      "end_ms": 3000,
      "frame_id": "SF-028-F03",
      "image_path": "frames/SF-028-F03.svg",
      "motion": "slow_observation motion; use push only at this state boundary.",
      "on_screen_text": "CHANGE",
      "sequence_number": 3,
      "shot_scale": "wide",
      "sound_cue": "voice_plus_accent aligned to the change action boundary; licensed or original audio only.",
      "start_ms": 2000,
      "story_function": "change action",
      "transition": "push",
      "visual_change": "Inbox to Queue: change action; advance one meaningful information state."
    },
    {
      "a_roll_state": "picture_in_picture",
      "acceptance_checks": [
        "Primary subject and editable label remain inside the planning safe zone.",
        "Frame differs materially from the previous state in meaning or visual orientation.",
        "No generated pixel text is relied on for final production."
      ],
      "broll_function": "attention_reset",
      "caption_relation": "keyword_emphasis",
      "composition": "split_screen clean-room 9:16 composition with editable overlays and safe-zone guide.",
      "end_ms": 4000,
      "frame_id": "SF-028-F04",
      "image_path": "frames/SF-028-F04.svg",
      "motion": "slow_observation motion; use push only at this state boundary.",
      "on_screen_text": "AFTER",
      "sequence_number": 4,
      "shot_scale": "wide",
      "sound_cue": "voice_plus_accent aligned to the after boundary; licensed or original audio only.",
      "start_ms": 3000,
      "story_function": "after",
      "transition": "push",
      "visual_change": "Inbox to Queue: after; advance one meaningful information state."
    },
    {
      "a_roll_state": "picture_in_picture",
      "acceptance_checks": [
        "Primary subject and editable label remain inside the planning safe zone.",
        "Frame differs materially from the previous state in meaning or visual orientation.",
        "No generated pixel text is relied on for final production."
      ],
      "broll_function": "attention_reset",
      "caption_relation": "on_cut",
      "composition": "split_screen clean-room 9:16 composition with editable overlays and safe-zone guide.",
      "end_ms": 5000,
      "frame_id": "SF-028-F05",
      "image_path": "frames/SF-028-F05.svg",
      "motion": "slow_observation motion; use push only at this state boundary.",
      "on_screen_text": "LIMIT",
      "sequence_number": 5,
      "shot_scale": "wide",
      "sound_cue": "voice_plus_accent aligned to the limitation boundary; licensed or original audio only.",
      "start_ms": 4000,
      "story_function": "limitation",
      "transition": "push",
      "visual_change": "Inbox to Queue: limitation; advance one meaningful information state."
    },
    {
      "a_roll_state": "picture_in_picture",
      "acceptance_checks": [
        "Primary subject and editable label remain inside the planning safe zone.",
        "Frame differs materially from the previous state in meaning or visual orientation.",
        "No generated pixel text is relied on for final production."
      ],
      "broll_function": "attention_reset",
      "caption_relation": "continuous",
      "composition": "split_screen clean-room 9:16 composition with editable overlays and safe-zone guide.",
      "end_ms": 6000,
      "frame_id": "SF-028-F06",
      "image_path": "frames/SF-028-F06.svg",
      "motion": "slow_observation motion; use push only at this state boundary.",
      "on_screen_text": "BRIDGE",
      "sequence_number": 6,
      "shot_scale": "wide",
      "sound_cue": "voice_plus_accent aligned to the bridge detail boundary; licensed or original audio only.",
      "start_ms": 5000,
      "story_function": "bridge detail",
      "transition": "push",
      "visual_change": "Inbox to Queue: bridge detail; advance one meaningful information state."
    },
    {
      "a_roll_state": "picture_in_picture",
      "acceptance_checks": [
        "Primary subject and editable label remain inside the planning safe zone.",
        "Frame differs materially from the previous state in meaning or visual orientation.",
        "No generated pixel text is relied on for final production."
      ],
      "broll_function": "attention_reset",
      "caption_relation": "continuous",
      "composition": "split_screen clean-room 9:16 composition with editable overlays and safe-zone guide.",
      "end_ms": 7000,
      "frame_id": "SF-028-F07",
      "image_path": "frames/SF-028-F07.svg",
      "motion": "slow_observation motion; use push only at this state boundary.",
      "on_screen_text": "COMPARE",
      "sequence_number": 7,
      "shot_scale": "wide",
      "sound_cue": "voice_plus_accent aligned to the hold comparison boundary; licensed or original audio only.",
      "start_ms": 6000,
      "story_function": "hold comparison",
      "transition": "push",
      "visual_change": "Inbox to Queue: hold comparison; advance one meaningful information state."
    }
  ],
  "framework_id": "SF-028",
  "kind": "intro_broll",
  "name": "Inbox to Queue",
  "purpose": "Convert reactive intake into controlled flow",
  "rights_state": "original_local_previsualization",
  "signal_input": {
    "evidence_ids": [
      "EVID-WEB-006"
    ],
    "export_id": "SIGEXP-SF-028",
    "export_schema": "signal-to-studio.v1",
    "record_hash": "sha256:1e0446d9c74e3a75f3162c99b3f90495f67563d26508fa3aa8cfa771f654384e",
    "rights_decision_ids": [
      "RIGHTS-PUBLIC-COMMENTARY-001"
    ],
    "source_ids": [
      "SRC-WEB-004"
    ],
    "source_rights_state": "metadata_commentary_only"
  },
  "taxonomy": {
    "a_roll_integration": "picture_in_picture",
    "broll_function": "attention_reset",
    "cta_exit": "comment_prompt",
    "hook_mechanism": "before_after",
    "pacing_profile": "slow_observation",
    "proof_form": "process_trace",
    "risk_class": "low",
    "sound_role": "voice_plus_accent",
    "text_role": "keyword_captions",
    "transition_family": "push",
    "viewer_job": "assess_risk",
    "visual_grammar": "split_screen"
  },
  "version": "1.0.0"
}
