{
  "aspect_ratio": "9:16",
  "duration_ms": 4000,
  "external_provider_state": "NOT_RUN",
  "frames": [
    {
      "a_roll_state": "full",
      "acceptance_checks": [
        "Primary subject and editable label remain inside the planning safe zone.",
        "Frame differs materially from the previous state in meaning or visual orientation.",
        "No generated pixel text is relied on for final production."
      ],
      "broll_function": "contrast",
      "caption_relation": "keyword_emphasis",
      "composition": "object_macro clean-room 9:16 composition with editable overlays and safe-zone guide.",
      "end_ms": 1000,
      "frame_id": "SF-049-F01",
      "image_path": "frames/SF-049-F01.svg",
      "motion": "rapid_beat motion; use hard_cut only at this state boundary.",
      "on_screen_text": "IN PROGRESS",
      "sequence_number": 1,
      "shot_scale": "macro",
      "sound_cue": "music_pulse aligned to the scene in progress boundary; licensed or original audio only.",
      "start_ms": 0,
      "story_function": "scene in progress",
      "transition": "hard_cut",
      "visual_change": "Missed Handoff: scene in progress; advance one meaningful information state."
    },
    {
      "a_roll_state": "voice_over",
      "acceptance_checks": [
        "Primary subject and editable label remain inside the planning safe zone.",
        "Frame differs materially from the previous state in meaning or visual orientation.",
        "No generated pixel text is relied on for final production."
      ],
      "broll_function": "contrast",
      "caption_relation": "on_cut",
      "composition": "object_macro clean-room 9:16 composition with editable overlays and safe-zone guide.",
      "end_ms": 2000,
      "frame_id": "SF-049-F02",
      "image_path": "frames/SF-049-F02.svg",
      "motion": "rapid_beat motion; use hard_cut only at this state boundary.",
      "on_screen_text": "STAKES",
      "sequence_number": 2,
      "shot_scale": "macro",
      "sound_cue": "music_pulse aligned to the stakes boundary; licensed or original audio only.",
      "start_ms": 1000,
      "story_function": "stakes",
      "transition": "hard_cut",
      "visual_change": "Missed Handoff: stakes; advance one meaningful information state."
    },
    {
      "a_roll_state": "voice_over",
      "acceptance_checks": [
        "Primary subject and editable label remain inside the planning safe zone.",
        "Frame differs materially from the previous state in meaning or visual orientation.",
        "No generated pixel text is relied on for final production."
      ],
      "broll_function": "contrast",
      "caption_relation": "on_cut",
      "composition": "object_macro clean-room 9:16 composition with editable overlays and safe-zone guide.",
      "end_ms": 3000,
      "frame_id": "SF-049-F03",
      "image_path": "frames/SF-049-F03.svg",
      "motion": "rapid_beat motion; use hard_cut only at this state boundary.",
      "on_screen_text": "ACT",
      "sequence_number": 3,
      "shot_scale": "medium",
      "sound_cue": "music_pulse aligned to the action boundary; licensed or original audio only.",
      "start_ms": 2000,
      "story_function": "action",
      "transition": "hard_cut",
      "visual_change": "Missed Handoff: action; advance one meaningful information state."
    },
    {
      "a_roll_state": "return_cut",
      "acceptance_checks": [
        "Primary subject and editable label remain inside the planning safe zone.",
        "Frame differs materially from the previous state in meaning or visual orientation.",
        "No generated pixel text is relied on for final production."
      ],
      "broll_function": "contrast",
      "caption_relation": "keyword_emphasis",
      "composition": "object_macro clean-room 9:16 composition with editable overlays and safe-zone guide.",
      "end_ms": 4000,
      "frame_id": "SF-049-F04",
      "image_path": "frames/SF-049-F04.svg",
      "motion": "rapid_beat motion; use hard_cut only at this state boundary.",
      "on_screen_text": "LESSON",
      "sequence_number": 4,
      "shot_scale": "macro",
      "sound_cue": "music_pulse aligned to the lesson boundary; licensed or original audio only.",
      "start_ms": 3000,
      "story_function": "lesson",
      "transition": "hard_cut",
      "visual_change": "Missed Handoff: lesson; advance one meaningful information state."
    }
  ],
  "framework_id": "SF-049",
  "kind": "intro_broll",
  "name": "Missed Handoff",
  "purpose": "Enter at the moment context disappears",
  "rights_state": "original_local_previsualization",
  "signal_input": {
    "evidence_ids": [
      "EVID-WEB-011"
    ],
    "export_id": "SIGEXP-SF-049",
    "export_schema": "signal-to-studio.v1",
    "record_hash": "sha256:2d648f5b20e0780b771cb7f42716cf8b7e2c16c9149b12393c8c4eba1d68aa76",
    "rights_decision_ids": [
      "RIGHTS-PUBLIC-COMMENTARY-001"
    ],
    "source_ids": [
      "SRC-WEB-001"
    ],
    "source_rights_state": "metadata_commentary_only"
  },
  "taxonomy": {
    "a_roll_integration": "full_open",
    "broll_function": "contrast",
    "cta_exit": "comment_prompt",
    "hook_mechanism": "story_in_progress",
    "pacing_profile": "rapid_beat",
    "proof_form": "observed_artifact",
    "risk_class": "source_dependent",
    "sound_role": "music_pulse",
    "text_role": "step_counter",
    "transition_family": "hard_cut",
    "viewer_job": "learn_mechanism",
    "visual_grammar": "object_macro"
  },
  "version": "1.0.0"
}
